{
  "knowledge_version": "234dfffb4aee",
  "source_workbook": "Parthia Health - HF Knowledge Base.xlsx",
  "sheet": "Rules",
  "notes": [],
  "rows": [
    {
      "rule_id": "R01",
      "name": "NSAID in heart failure",
      "category": "Drug–disease",
      "drugs": "NSAIDs (ibuprofen, naproxen, diclofenac, celecoxib)",
      "data_needed": "HF diagnosis; medication list incl. OTC",
      "condition": "Patient with HF has an active NSAID",
      "threshold_values": "Any use",
      "severity_text": "High",
      "patient_question": "I was given [drug] for pain. Is it safe with my heart failure, and is there a safer option?",
      "clinician_note": "NSAIDs can cause sodium/fluid retention, worsen HF and kidney function, and blunt diuretics.",
      "source_ids_text": "S07; S01",
      "section": "Verify",
      "agent": "Pharmacist",
      "phenotype": "All HF",
      "data_sources": "EHR, scan, patient",
      "comments": "Harold/Margaret demo",
      "review_status_text": "Draft – verify",
      "reviewed_by": null,
      "date_reviewed": null,
      "kb_domain": "1. Drugs that worsen HF",
      "source_ids": [
        "S01",
        "S07"
      ],
      "review_status": "draft_verify",
      "severity": "high",
      "element_ids": [],
      "threshold_ids": []
    },
    {
      "rule_id": "R02",
      "name": "High potassium on an MRA",
      "category": "Lab monitoring",
      "drugs": "Spironolactone, eplerenone",
      "data_needed": "Potassium (latest, date); MRA active",
      "condition": "MRA active AND potassium ≥ threshold",
      "threshold_values": "K ≥ 5.5 mEq/L (verify)",
      "severity_text": "High",
      "patient_question": "My potassium was [value]. Should my [MRA] be adjusted?",
      "clinician_note": "Guideline recommends stopping the MRA if potassium cannot be kept below the threshold.",
      "source_ids_text": "S01",
      "section": "MRA section – verify",
      "agent": "Pharmacist + Cardiology",
      "phenotype": "HFrEF",
      "data_sources": "EHR, lab scan",
      "comments": null,
      "review_status_text": "Draft – verify",
      "reviewed_by": null,
      "date_reviewed": null,
      "kb_domain": "2. Potassium & kidney",
      "source_ids": [
        "S01"
      ],
      "review_status": "draft_verify",
      "severity": "high",
      "element_ids": [],
      "threshold_ids": []
    },
    {
      "rule_id": "R03",
      "name": "Low kidney function on an MRA",
      "category": "Lab monitoring",
      "drugs": "Spironolactone, eplerenone",
      "data_needed": "eGFR or creatinine (latest, trend); MRA active",
      "condition": "MRA active AND eGFR ≤ threshold",
      "threshold_values": "eGFR ≤ 30 mL/min/1.73m² (verify)",
      "severity_text": "High",
      "patient_question": "My kidney test changed. Is [MRA] still right for me?",
      "clinician_note": "Check guideline eligibility thresholds for MRA use.",
      "source_ids_text": "S01",
      "section": "MRA section – verify",
      "agent": "Pharmacist",
      "phenotype": "HFrEF",
      "data_sources": "EHR, lab scan",
      "comments": null,
      "review_status_text": "Draft – verify",
      "reviewed_by": null,
      "date_reviewed": null,
      "kb_domain": "2. Potassium & kidney",
      "source_ids": [
        "S01"
      ],
      "review_status": "draft_verify",
      "severity": "high",
      "element_ids": [],
      "threshold_ids": []
    },
    {
      "rule_id": "R04",
      "name": "Non-dihydropyridine calcium channel blocker in HFrEF",
      "category": "Drug–disease",
      "drugs": "Diltiazem, verapamil",
      "data_needed": "LVEF / phenotype; medication list",
      "condition": "HFrEF AND diltiazem or verapamil active",
      "threshold_values": "Any use",
      "severity_text": "High",
      "patient_question": "Is [drug] appropriate with my type of heart failure?",
      "clinician_note": "Negative inotropes; guideline lists as potentially harmful in HFrEF.",
      "source_ids_text": "S01; S07",
      "section": "Verify",
      "agent": "Pharmacist + Cardiology",
      "phenotype": "HFrEF",
      "data_sources": "EHR, scan",
      "comments": null,
      "review_status_text": "Draft – verify",
      "reviewed_by": null,
      "date_reviewed": null,
      "kb_domain": "1. Drugs that worsen HF",
      "source_ids": [
        "S01",
        "S07"
      ],
      "review_status": "draft_verify",
      "severity": "high",
      "element_ids": [],
      "threshold_ids": []
    },
    {
      "rule_id": "R05",
      "name": "Thiazolidinedione in heart failure",
      "category": "Drug–disease",
      "drugs": "Pioglitazone, rosiglitazone",
      "data_needed": "HF diagnosis; medication list",
      "condition": "HF AND thiazolidinedione active",
      "threshold_values": "Any use",
      "severity_text": "High",
      "patient_question": "Is [drug] safe for my heart failure?",
      "clinician_note": "Fluid retention and HF worsening.",
      "source_ids_text": "S01; S07",
      "section": "Verify",
      "agent": "Pharmacist",
      "phenotype": "All HF",
      "data_sources": "EHR, scan",
      "comments": null,
      "review_status_text": "Draft – verify",
      "reviewed_by": null,
      "date_reviewed": null,
      "kb_domain": "1. Drugs that worsen HF",
      "source_ids": [
        "S01",
        "S07"
      ],
      "review_status": "draft_verify",
      "severity": "high",
      "element_ids": [],
      "threshold_ids": []
    },
    {
      "rule_id": "R06",
      "name": "ARNI with ACE inhibitor",
      "category": "Drug–drug",
      "drugs": "Sacubitril/valsartan + any ACE inhibitor",
      "data_needed": "Medication list with start/stop dates",
      "condition": "Both active, or ACE inhibitor stopped < 36 h before ARNI start",
      "threshold_values": "36-hour washout",
      "severity_text": "High",
      "patient_question": "I see both [ARNI] and [ACE inhibitor] on my list. Should I be taking both?",
      "clinician_note": "Contraindicated combination (angioedema risk) per FDA label.",
      "source_ids_text": "S09",
      "section": "Sacubitril/valsartan label – Contraindications",
      "agent": "Pharmacist",
      "phenotype": "All HF",
      "data_sources": "EHR, scan",
      "comments": null,
      "review_status_text": "Draft – verify",
      "reviewed_by": null,
      "date_reviewed": null,
      "kb_domain": "4. Core HF medicines",
      "source_ids": [
        "S09"
      ],
      "review_status": "draft_verify",
      "severity": "high",
      "element_ids": [],
      "threshold_ids": []
    },
    {
      "rule_id": "R07",
      "name": "Potassium salt substitute with RAAS inhibitor or MRA",
      "category": "Drug–food",
      "drugs": "ACE inhibitor, ARB, ARNI, MRA",
      "data_needed": "Diet log tag: potassium salt substitute; medication list; potassium",
      "condition": "RAAS inhibitor or MRA active AND salt substitute logged",
      "threshold_values": "Any use (higher severity if MRA or K rising)",
      "severity_text": "Moderate",
      "patient_question": "I use a salt substitute. Is it safe with my heart medicines?",
      "clinician_note": "Most salt substitutes contain potassium chloride.",
      "source_ids_text": "S09",
      "section": "Labels – potassium warnings",
      "agent": "Pharmacist + Nutrition",
      "phenotype": "All HF",
      "data_sources": "Patient",
      "comments": "Margaret HF demo",
      "review_status_text": "Draft – verify",
      "reviewed_by": null,
      "date_reviewed": null,
      "kb_domain": "8. Nutrition",
      "source_ids": [
        "S09"
      ],
      "review_status": "draft_verify",
      "severity": "moderate",
      "element_ids": [],
      "threshold_ids": []
    },
    {
      "rule_id": "R08",
      "name": "Rapid weight gain",
      "category": "Home monitoring",
      "drugs": "Diuretics (context)",
      "data_needed": "Daily weight",
      "condition": "Weight increase over 1 day or 7 days above threshold",
      "threshold_values": "≥ 2 lb (~1 kg) in 1 day or ≥ 5 lb (~2.3 kg) in 1 week (verify; clinician may individualize)",
      "severity_text": "Moderate",
      "patient_question": "My weight went up [amount] in [days]. Should I contact my care team?",
      "clinician_note": "Possible fluid retention; review diuretic plan.",
      "source_ids_text": "S12",
      "section": "Self-care education – verify",
      "agent": "Cardiology",
      "phenotype": "All HF",
      "data_sources": "Scale, patient",
      "comments": "Margaret HF demo",
      "review_status_text": "Draft – verify",
      "reviewed_by": null,
      "date_reviewed": null,
      "kb_domain": "3. Diuretics & congestion",
      "source_ids": [
        "S12"
      ],
      "review_status": "draft_verify",
      "severity": "moderate",
      "element_ids": [],
      "threshold_ids": []
    },
    {
      "rule_id": "R09",
      "name": "Low blood pressure with symptoms on several BP-lowering drugs",
      "category": "Home monitoring",
      "drugs": "Beta-blockers, ACEi/ARB/ARNI, MRA, diuretics, SGLT2i",
      "data_needed": "Home BP; dizziness/falls; medication list",
      "condition": "≥ 2 BP-lowering drugs AND low systolic readings AND dizziness",
      "threshold_values": "Systolic < 90 mmHg on ≥ 2 readings (verify)",
      "severity_text": "Moderate",
      "patient_question": "I feel dizzy and my blood pressure is low. Should my medicines be reviewed?",
      "clinician_note": "Consider timing and dosing; review in context of HF therapy priorities.",
      "source_ids_text": "S02",
      "section": "Verify",
      "agent": "Cardiology",
      "phenotype": "All HF",
      "data_sources": "BP cuff, patient",
      "comments": null,
      "review_status_text": "Draft – verify",
      "reviewed_by": null,
      "date_reviewed": null,
      "kb_domain": "5. BP & heart rate",
      "source_ids": [
        "S02"
      ],
      "review_status": "draft_verify",
      "severity": "moderate",
      "element_ids": [],